{
  "$schema": "https://json-schema.org/draft/2020-12/schema",
  "title": "Checkpoint hint v1",
  "type": "object",
  "additionalProperties": false,
  "required": [
    "schema_version",
    "checkpoint_sha256",
    "hint_text",
    "evidence_refs",
    "relation_to_original",
    "limitations"
  ],
  "properties": {
    "schema_version": {
      "const": "hint-v1"
    },
    "checkpoint_sha256": {
      "type": "string",
      "pattern": "^[0-9a-f]{64}$"
    },
    "hint_text": {
      "type": "string",
      "minLength": 1
    },
    "evidence_refs": {
      "type": "array",
      "minItems": 1,
      "items": {
        "type": "object",
        "additionalProperties": false,
        "required": [
          "source_id",
          "observation"
        ],
        "properties": {
          "source_id": {
            "type": "string",
            "minLength": 1
          },
          "observation": {
            "type": "string",
            "minLength": 1
          }
        }
      }
    },
    "relation_to_original": {
      "enum": [
        "original_next_action",
        "later_verified_repair",
        "alternative_supported_action",
        "validation_or_compatibility",
        "insufficient_evidence"
      ]
    },
    "limitations": {
      "type": "array",
      "items": {
        "type": "string"
      }
    }
  }
}
