{
  "schema_version": "hint-v1",
  "checkpoint_sha256": "be4722b8e8360dfc957facb1c1631c9abaf0a85581611c3a3d47cd7c17c64a15",
  "hint_text": "Verus now fails only at the sequence-equality macro for s1 and s2. The length reasoning is no longer the problem, but the macro cannot derive pointwise equality from the concatenation equality by itself. Next objective: in the branch where s1 + suffix == s2 + suffix, prove that for every valid prefix index i, s1[i] == s2[i]. Use the assumed equality of the concatenated sequences at that same i, then unfold the meaning of concatenation indexing in the prefix range so that (s1 + suffix)[i] is s1[i] and (s2 + suffix)[i] is s2[i]. Once length equality and this pointwise prefix equality are available, close by sequence extensionality rather than relying only on the macro. Re-run Verus: a successful edit should eliminate the macro failure and report 1 verified, 0 errors, possibly with only an unused-import warning.",
  "evidence_refs": [
    {
      "source_id": "event:62",
      "observation": "The Verus diagnostic reports assertion failed only at assert_seqs_equal!(s1, s2), with no remaining length-equality failure."
    },
    {
      "source_id": "snapshot:be4722b8e8360dfc957facb1c1631c9abaf0a85581611c3a3d47cd7c17c64a15",
      "observation": "The checkpoint has already established concatenated length equalities but still relies on the sequence-equality macro to prove s1 == s2."
    },
    {
      "source_id": "snapshot:0545d14072735e4060ce6040818c7932dc35cf557136050dc3ba8a427289c239",
      "observation": "The later verified proof proves pointwise prefix equality explicitly before closing by extensionality, confirming the missing prerequisite."
    },
    {
      "source_id": "final_validation",
      "observation": "The final proof passes Verus and Lynette with this pointwise prefix equality strategy."
    }
  ],
  "relation_to_original": "later_verified_repair",
  "limitations": [
    "The hint describes the logical gap and proof strategy but does not specify the exact quantifier, trigger, or assertion syntax the solver must choose."
  ]
}
